<?xml version="1.0" encoding="utf-8" ?>
<?xml-stylesheet type="text/xsl" href="./env.xsl"?>
<DBS xmlns:xsi="http://www.w3.org/2001/XMLSchema-instance" xsi:schemaLocation=" env ./env.xsd">
	<SqlServer>
		<Server>localhost</Server>
		<InitialCatalog>ENSA_TANGER</InitialCatalog>
		<IntegratedSecurity>True</IntegratedSecurity>
	</SqlServer>
	<MySql>
		<Server>localhost</Server>
		<uid>root</uid>
		<pwd></pwd>
		<Database>ENSA_TANGER</Database>
	</MySql>
	<Oracle>
		<Server>localhost:1521/orclpdb</Server>
		<TNS_ADMIN>C:\\Users\\mouad\\Oracle\\network\\admin</TNS_ADMIN>
		<USER_ID>ENSA_TANGER</USER_ID>
	</Oracle>
</DBS>
